Carimbo de data/hora,Nome,Descrição
08/12/2021 09:49:05,Hidrocinese,Cinese Elemental. Permite criar e controlar o elemento da água.
08/12/2021 09:55:32,Agilidade,Habilidade básica de mobilidade. Define o quão rápido e preciso seu corpo pode se mover.
08/12/2021 09:58:52,Resistência Física,Habilidade básica. Define o quão resistente seu corpo é à dano físico. Anulação de dano ocorre caso o nível da resistência seja +15 níveis do que o dano.
08/12/21 14:26:36,Força,Habilidade basica. Define o quanto de força fisica o usuario pode aplicar.
08/12/21 14:27:28,Velocidade,Habilidade basica de movimentaçao. Define o quao rapido um personagem se move de um ponto a outro.
08/12/21 14:27:58,Criocinese,Cinese Solida. Pode criar e controlar gelo.
